,org_url,handle,type,class,flag,priority,platform,post_id,text,post_text,shared_text,time,image,video,video_thumbnail,video_id,likes,comments,shares,post_url,link,user_id,username,is_live,images
8,https://www.facebook.com/AARPpolicy,aarp,Organizations,Aging Organizations,,Y,Facebook,10159456684623960,"About 1 in 3 people between the ages of 65 and 74, and nearly half of those older than 75, have trouble hearing. Get to know some of the common signs of hearing loss you may pick up on in yourself, or your family and friends.

AARP.ORG
10 Signs That You Could Have Hearing Loss","About 1 in 3 people between the ages of 65 and 74, and nearly half of those older than 75, have trouble hearing. Get to know some of the common signs of hearing loss you may pick up on in yourself, or your family and friends.","AARP.ORG
10 Signs That You Could Have Hearing Loss",2021-04-05 10:04:33,,,,,45,8,6,https://facebook.com/aarp/posts/10159456684623960,http://spr.ly/6186HIyu6,57259033959,AARP,False,[]
41,https://www.facebook.com/SEIU,seiu,Organizations,Labor,,N,Facebook,10157640557442680,"When we unite in our union, we have a seat at the table! And by building power in numbers, we're able to negotiate higher wages, better benefits and a secure retirement which helps bring working people into the middle-class. When we join together in a union, we start to close racial and gender pay gaps.","When we unite in our union, we have a seat at the table! And by building power in numbers, we're able to negotiate higher wages, better benefits and a secure retirement which helps bring working people into the middle-class. When we join together in a union, we start to close racial and gender pay gaps.",,2021-04-05 09:57:42,https://scontent-iad3-2.xx.fbcdn.net/v/t1.6435-9/169912712_10157640587617680_5271739488337959587_n.png?_nc_cat=109&ccb=1-3&_nc_sid=8024bb&_nc_ohc=atgO76VOc1sAX8w1ly_&_nc_ht=scontent-iad3-2.xx&oh=9fa9876d7514d7a1dcaac39ddfa09505&oe=60922E38,,,,230,22,0,https://facebook.com/seiu/posts/10157640557442680,,19972147679,SEIU,False,['https://scontent-iad3-2.xx.fbcdn.net/v/t1.6435-9/169912712_10157640587617680_5271739488337959587_n.png?_nc_cat=109&ccb=1-3&_nc_sid=8024bb&_nc_ohc=atgO76VOc1sAX8w1ly_&_nc_ht=scontent-iad3-2.xx&oh=9fa9876d7514d7a1dcaac39ddfa09505&oe=60922E38']
19,https://www.facebook.com/NCOAging,ncoaging,Organizations,Aging Organizations,,Y,Facebook,3772232382831747,"Today's #MondayMotivation is your reason to save for #retirement.
In 2020, the top reason in the U.S. was ""turning a certain age,"" with ""employer offered a matching contribution"", according to Statista.
What's your reason? Tell us in the comments!
#FinancialLiteracyMonth","Today's #MondayMotivation is your reason to save for #retirement.
In 2020, the top reason in the U.S. was ""turning a certain age,"" with ""employer offered a matching contribution"", according to Statista.
What's your reason? Tell us in the comments!
#FinancialLiteracyMonth",,2021-04-05 09:57:03,https://scontent-iad3-2.xx.fbcdn.net/v/t1.6435-9/fr/cp0/e15/q65/169591722_3772252639496388_8987130204501386469_n.jpg?_nc_cat=102&ccb=1-3&_nc_sid=8024bb&_nc_ohc=ft7Ra7mr5j0AX9PUIfu&_nc_ht=scontent-iad3-2.xx&tp=14&oh=61146a9421337d35b15886b728d45c01&oe=608FD95E,,,,5,0,0,https://facebook.com/ncoaging/posts/3772232382831747,,131217580266597,National Council on Aging,False,['https://scontent-iad3-2.xx.fbcdn.net/v/t1.6435-9/fr/cp0/e15/q65/169591722_3772252639496388_8987130204501386469_n.jpg?_nc_cat=102&ccb=1-3&_nc_sid=8024bb&_nc_ohc=ft7Ra7mr5j0AX9PUIfu&_nc_ht=scontent-iad3-2.xx&tp=14&oh=61146a9421337d35b15886b728d45c01&oe=608FD95E']
31,https://www.facebook.com/RANDCorporation,randcorporation,Organizations,Foundations & Think Tanks ,,N,Facebook,10159797720943676,"What factors lead individuals to join violent extremist organizations? And how do extremists become deradicalized?

Our new report offers insights based on interviews with former members of extremist groups and their families.

RAND.ORG
Violent Extremism in America: Firsthand Accounts","What factors lead individuals to join violent extremist organizations? And how do extremists become deradicalized?

Our new report offers insights based on interviews with former members of extremist groups and their families.","RAND.ORG
Violent Extremism in America: Firsthand Accounts",2021-04-05 09:15:04,,,,,12,1,5,https://facebook.com/randcorporation/posts/10159797720943676,https://www.rand.org/pubs/research_reports/RRA1071-1.html?utm_campaign=&utm_content=1617628502&utm_medium=rand_social&utm_source=facebook,55708608675,RAND Corporation,False,[]
26,https://www.facebook.com/PHInational,phinational,Organizations,Foundations & Think Tanks ,,N,Facebook,10157479496320583,"This week, PHI will bring its expertise on the direct care workforce to 'On Aging,' the largest multidisciplinary conference on aging in the United States—hosted by the American Society on Aging. If you’re attending this virtual conference, please join us at our presentations, which are listed in this article. We look forward to seeing you!

PHINATIONAL.ORG
PHI Takes the Stage at ‘On Aging’ National Virtual Conference","This week, PHI will bring its expertise on the direct care workforce to 'On Aging,' the largest multidisciplinary conference on aging in the United States—hosted by the American Society on Aging. If you’re attending this virtual conference, please join us at our presentations, which are listed in this article. We look forward to seeing you!","PHINATIONAL.ORG
PHI Takes the Stage at ‘On Aging’ National Virtual Conference",2021-04-05 08:57:59,,,,,0,0,0,https://facebook.com/phinational/posts/10157479496320583,https://phinational.org/phi-takes-the-stage-at-on-aging-national-virtual-conference/,127691390582,PHI,False,[]
38,https://www.facebook.com/NAHCA,nahca,Organizations,Labor,,N,Facebook,10157875080071475,"It's almost here! Our virtual CNA March on Washington is set for Wednesday. Will you join over 1,000 of your friends and colleagues who have already signed up?
https://www.nahcacna.org/cna-virtual-march-on-washington/

NAHCACNA.ORG
CNA Virtual March on Washington | NAHCA","It's almost here! Our virtual CNA March on Washington is set for Wednesday. Will you join over 1,000 of your friends and colleagues who have already signed up?
https://www.nahcacna.org/cna-virtual-march-on-washington/","NAHCACNA.ORG
CNA Virtual March on Washington | NAHCA",2021-04-05 08:45:04,,,,,4,0,3,https://facebook.com/nahca/posts/10157875080071475,https://www.nahcacna.org/cna-virtual-march-on-washington/,345843311474,National Association of Health Care Assistants,False,[]
42,https://www.facebook.com/SEIU,seiu,Organizations,Labor,,N,Facebook,10157639649962680,"Women's work has value. Black women's work has value. Brown women's work has value. Immigrant women's work has value. Care work must be valued.

COMMONDREAMS.ORG
Opinion | Care Workers Are Essential But Severely Undervalued",Women's work has value. Black women's work has value. Brown women's work has value. Immigrant women's work has value. Care work must be valued.,"COMMONDREAMS.ORG
Opinion | Care Workers Are Essential But Severely Undervalued",2021-04-04 20:00:07,,,,,30,0,6,https://facebook.com/seiu/posts/10157639649962680,https://bit.ly/2PuXZzz,19972147679,SEIU,False,[]
43,https://www.facebook.com/SEIU,seiu,Organizations,Labor,,N,Facebook,10157639244282680,"No one should be evicted in a pandemic. Pass it on.

BUSINESSINSIDER.COM
One millionaire landlord was behind half of Milwaukee's evictions during Covid lockdowns last June. Here's the story of how corporate landlords helped drive the evictions crisis",No one should be evicted in a pandemic. Pass it on.,"BUSINESSINSIDER.COM
One millionaire landlord was behind half of Milwaukee's evictions during Covid lockdowns last June. Here's the story of how corporate landlords helped drive the evictions crisis",2021-04-04 16:00:05,,,,,16,2,10,https://facebook.com/seiu/posts/10157639244282680,https://bit.ly/31D6zPj,19972147679,SEIU,False,[]
32,https://www.facebook.com/RANDCorporation,randcorporation,Organizations,Foundations & Think Tanks ,,N,Facebook,10159795991268676,"During future U.S. political campaigns, Russia might try again to manipulate and divide voters via social media. This new report describes how Americans respond to Russian-made memes designed to breed conflict — and why public service announcements about foreign election interference might help.

RAND.ORG
PSAs Might Prevent Foreign Disinformation from Taking Hold","During future U.S. political campaigns, Russia might try again to manipulate and divide voters via social media. This new report describes how Americans respond to Russian-made memes designed to breed conflict — and why public service announcements about foreign election interference might help.","RAND.ORG
PSAs Might Prevent Foreign Disinformation from Taking Hold",2021-04-04 15:17:04,,,,,22,0,4,https://facebook.com/randcorporation/posts/10159795991268676,https://www.rand.org/pubs/research_reports/RRA704-4.html?utm_campaign=&utm_content=1617563820&utm_medium=rand_social&utm_source=facebook,55708608675,RAND Corporation,False,[]
9,https://www.facebook.com/AARPpolicy,aarp,Organizations,Aging Organizations,,Y,Facebook,10159454852953960,"The CDC has once again updated its information on who is most at risk for severe illness from a coronavirus infection. Heart disease, obesity, diabetes and more are among the conditions, but here's a look at the expanded list.

AARP.ORG
CDC Expands List of Risks for Severe COVID-19","The CDC has once again updated its information on who is most at risk for severe illness from a coronavirus infection. Heart disease, obesity, diabetes and more are among the conditions, but here's a look at the expanded list.","AARP.ORG
CDC Expands List of Risks for Severe COVID-19",2021-04-04 15:12:05,,,,,111,26,31,https://facebook.com/aarp/posts/10159454852953960,http://spr.ly/6186HxkGs,57259033959,AARP,False,[]
10,https://www.facebook.com/AARPpolicy,aarp,Organizations,Aging Organizations,,Y,Facebook,10159454689528960,"COVID couldn't steal 82-year-old La Verne Wimberly's shine. La Verne has continued to dress up for church service every week, even from home. See some of her best looks and the inspiring message she shares with others.

AARP.ORG
Tulsa Woman's Church Outfits Catch Attention Online","COVID couldn't steal 82-year-old La Verne Wimberly's shine. La Verne has continued to dress up for church service every week, even from home. See some of her best looks and the inspiring message she shares with others.","AARP.ORG
Tulsa Woman's Church Outfits Catch Attention Online",2021-04-04 13:45:56,,,,,3030,326,199,https://facebook.com/aarp/posts/10159454689528960,http://spr.ly/6183HxXLt,57259033959,AARP,False,[]
20,https://www.facebook.com/NCOAging,ncoaging,Organizations,Aging Organizations,,Y,Facebook,3769264926461826,"Recognize a LEADER!
Know someone at a #seniorcenter who has created innovative solutions to improve the health and economic security of #olderadults?
Nominate them for this year's National Institute of Senior Centers' (NISC) Founder Award! The deadline for submissions has been extended to Friday, April 9.
https://bit.ly/3udUix8","Recognize a LEADER!
Know someone at a #seniorcenter who has created innovative solutions to improve the health and economic security of #olderadults?
Nominate them for this year's National Institute of Senior Centers' (NISC) Founder Award! The deadline for submissions has been extended to Friday, April 9.
https://bit.ly/3udUix8",,2021-04-04 13:14:32,https://scontent-iad3-2.xx.fbcdn.net/v/t1.6435-9/fr/cp0/e15/q65/168439630_3769273133127672_7473399908312936781_n.jpg?_nc_cat=111&ccb=1-3&_nc_sid=8024bb&_nc_ohc=C6RlCRU6wNMAX9S6thm&_nc_ht=scontent-iad3-2.xx&tp=14&oh=33e9337844c7e4666d755ccd4d314796&oe=60911B6E,,,,16,1,0,https://facebook.com/ncoaging/posts/3769264926461826,https://bit.ly/3udUix8,131217580266597,National Council on Aging,False,['https://scontent-iad3-2.xx.fbcdn.net/v/t1.6435-9/fr/cp0/e15/q65/168439630_3769273133127672_7473399908312936781_n.jpg?_nc_cat=111&ccb=1-3&_nc_sid=8024bb&_nc_ohc=C6RlCRU6wNMAX9S6thm&_nc_ht=scontent-iad3-2.xx&tp=14&oh=33e9337844c7e4666d755ccd4d314796&oe=60911B6E']
28,https://www.facebook.com/milkeninstitute,milkeninstitute,Organizations,Foundations & Think Tanks ,,N,Facebook,10158048697982525,"As our country ages and diversifies, we must support and promote health equity for Black and Latino communities.

Our latest report recommends five ways to build better brain health and reduce disparities in dementia care: bit.ly/2PaKTHF","As our country ages and diversifies, we must support and promote health equity for Black and Latino communities.

Our latest report recommends five ways to build better brain health and reduce disparities in dementia care: bit.ly/2PaKTHF",,2021-04-04 13:09:01,https://scontent-iad3-2.xx.fbcdn.net/v/t1.6435-9/fr/cp0/e15/q65/169173946_10158048697987525_6044846258875437498_n.jpg?_nc_cat=100&ccb=1-3&_nc_sid=da1649&_nc_ohc=Fb8rtKo6HsIAX9BlUz_&_nc_ht=scontent-iad3-2.xx&tp=14&oh=e70e3b9b66f6eeff9904093812eb6223&oe=6091D301,,,,6,0,0,https://facebook.com/milkeninstitute/posts/10158048697982525,https://bit.ly/2PaKTHF,48724667524,Milken Institute,False,"['https://scontent-iad3-2.xx.fbcdn.net/v/t1.6435-9/fr/cp0/e15/q65/169173946_10158048697987525_6044846258875437498_n.jpg?_nc_cat=100&ccb=1-3&_nc_sid=da1649&_nc_ohc=Fb8rtKo6HsIAX9BlUz_&_nc_ht=scontent-iad3-2.xx&tp=14&oh=e70e3b9b66f6eeff9904093812eb6223&oe=6091D301', 'https://scontent-iad3-2.xx.fbcdn.net/v/t1.6435-9/fr/cp0/e15/q65/169173946_10158048697987525_6044846258875437498_n.jpg?_nc_cat=100&ccb=1-3&_nc_sid=da1649&_nc_ohc=Fb8rtKo6HsIAX9BlUz_&_nc_ht=scontent-iad3-2.xx&tp=14&oh=e70e3b9b66f6eeff9904093812eb6223&oe=6091D301', 'https://scontent-iad3-2.xx.fbcdn.net/v/t1.6435-9/fr/cp0/e15/q65/169173946_10158048697987525_6044846258875437498_n.jpg?_nc_cat=100&ccb=1-3&_nc_sid=da1649&_nc_ohc=Fb8rtKo6HsIAX9BlUz_&_nc_ht=scontent-iad3-2.xx&tp=14&oh=e70e3b9b66f6eeff9904093812eb6223&oe=6091D301']"
11,https://www.facebook.com/AARPpolicy,aarp,Organizations,Aging Organizations,,Y,Facebook,10159454554373960,"""Scammers stay on top of whatever is new, such as the popularity of Zoom, COVID-19 vaccines and online shopping,"" says fraud expert Amy Nofziger. Here are some frauds targeting older Americans that are happening right now.

AARP.ORG
Top Scams Targeting Older Americans in 2021","""Scammers stay on top of whatever is new, such as the popularity of Zoom, COVID-19 vaccines and online shopping,"" says fraud expert Amy Nofziger. Here are some frauds targeting older Americans that are happening right now.","AARP.ORG
Top Scams Targeting Older Americans in 2021",2021-04-04 12:33:53,,,,,147,31,79,https://facebook.com/aarp/posts/10159454554373960,http://spr.ly/6189HxXxP,57259033959,AARP,False,[]
44,https://www.facebook.com/SEIU,seiu,Organizations,Labor,,N,Facebook,10157638868842680,"Talk is cheap, Coca-Cola & Delta. If you want to do right by voters in Georgia, stop funding racist vote-suppressing politicians.

THEGUARDIAN.COM
Delta and Coca-Cola pivot on Georgia’s restrictive voting law: 'It's unacceptable'","Talk is cheap, Coca-Cola & Delta. If you want to do right by voters in Georgia, stop funding racist vote-suppressing politicians.","THEGUARDIAN.COM
Delta and Coca-Cola pivot on Georgia’s restrictive voting law: 'It's unacceptable'",2021-04-04 12:00:23,,,,,111,16,19,https://facebook.com/seiu/posts/10157638868842680,https://bit.ly/3udBI8m,19972147679,SEIU,False,[]
12,https://www.facebook.com/AARPpolicy,aarp,Organizations,Aging Organizations,,Y,Facebook,10159454365783960,"“I feel like I've been cheated out of a year,"" says Tina Gould, 64. As more older Americans receive their coronavirus vaccines, many grandparents are reuniting with their grandkids for the first time in a year. Read some of their stories.

AARP.ORG
Vaccinated Grandparents Rejoice, Plan Reunions","“I feel like I've been cheated out of a year,"" says Tina Gould, 64. As more older Americans receive their coronavirus vaccines, many grandparents are reuniting with their grandkids for the first time in a year. Read some of their stories.","AARP.ORG
Vaccinated Grandparents Rejoice, Plan Reunions",2021-04-04 11:06:01,,,,,445,99,28,https://facebook.com/aarp/posts/10159454365783960,http://spr.ly/6186HxGX0,57259033959,AARP,False,[]
13,https://www.facebook.com/AARPpolicy,aarp,Organizations,Aging Organizations,,Y,Facebook,10159454277853960,"How do you choose the jeans that work for your current body and lifestyle? From the cut to the wash and everything in between, we've got the tips to help you pick the right pair.

AARP.ORG
10 Ways to Look Better in Jeans","How do you choose the jeans that work for your current body and lifestyle? From the cut to the wash and everything in between, we've got the tips to help you pick the right pair.","AARP.ORG
10 Ways to Look Better in Jeans",2021-04-04 10:26:36,,,,,73,29,7,https://facebook.com/aarp/posts/10159454277853960,http://spr.ly/6188HxXQp,57259033959,AARP,False,[]
14,https://www.facebook.com/AARPpolicy,aarp,Organizations,Aging Organizations,,Y,Facebook,10159454121953960,"Billions — yes, you read that right, billions — of cicadas will scratch their way to earth's surface to screech their mating calls, copulate and lay eggs throughout much of the Eastern half of the United States. Here's what to expect.

AARP.ORG
Billions of Cicadas Set to Invade the Eastern U.S.","Billions — yes, you read that right, billions — of cicadas will scratch their way to earth's surface to screech their mating calls, copulate and lay eggs throughout much of the Eastern half of the United States. Here's what to expect.","AARP.ORG
Billions of Cicadas Set to Invade the Eastern U.S.",2021-04-04 09:05:53,,,,,197,57,214,https://facebook.com/aarp/posts/10159454121953960,http://spr.ly/6184Hxno8,57259033959,AARP,False,[]
45,https://www.facebook.com/SEIU,seiu,Organizations,Labor,,N,Facebook,10157637630977680,There is no moving forward without investment in those hurt most by the pandemic. It’s time for our leaders to set things right by passing the American Jobs Plan! Call 1-833-312-1833 ✊#JobsAndCare,There is no moving forward without investment in those hurt most by the pandemic. It’s time for our leaders to set things right by passing the American Jobs Plan! Call 1-833-312-1833 ✊#JobsAndCare,,2021-04-03 21:00:13,https://scontent-iad3-2.xx.fbcdn.net/v/t1.6435-9/168600665_10157637630982680_6752727963637041214_n.png?_nc_cat=111&ccb=1-3&_nc_sid=da1649&_nc_ohc=07w3778_dQMAX8CF-_7&_nc_ht=scontent-iad3-2.xx&oh=85b5fcadeff9246090d840bd15bdc35d&oe=60904342,,,,52,3,0,https://facebook.com/seiu/posts/10157637630977680,,19972147679,SEIU,False,"['https://scontent-iad3-2.xx.fbcdn.net/v/t1.6435-9/168600665_10157637630982680_6752727963637041214_n.png?_nc_cat=111&ccb=1-3&_nc_sid=da1649&_nc_ohc=07w3778_dQMAX8CF-_7&_nc_ht=scontent-iad3-2.xx&oh=85b5fcadeff9246090d840bd15bdc35d&oe=60904342', 'https://scontent-iad3-2.xx.fbcdn.net/v/t1.6435-9/168600665_10157637630982680_6752727963637041214_n.png?_nc_cat=111&ccb=1-3&_nc_sid=da1649&_nc_ohc=07w3778_dQMAX8CF-_7&_nc_ht=scontent-iad3-2.xx&oh=85b5fcadeff9246090d840bd15bdc35d&oe=60904342', 'https://scontent-iad3-2.xx.fbcdn.net/v/t1.6435-9/168600665_10157637630982680_6752727963637041214_n.png?_nc_cat=111&ccb=1-3&_nc_sid=da1649&_nc_ohc=07w3778_dQMAX8CF-_7&_nc_ht=scontent-iad3-2.xx&oh=85b5fcadeff9246090d840bd15bdc35d&oe=60904342']"
46,https://www.facebook.com/SEIU,seiu,Organizations,Labor,,N,Facebook,10157632741842680,"IDEA: What if instead of making fake happy worker Twitter accounts, Amazon just treated workers like human beings?

WASHINGTONPOST.COM
Twitter nixes a handful of accounts pretending to be happy Amazon workers","IDEA: What if instead of making fake happy worker Twitter accounts, Amazon just treated workers like human beings?","WASHINGTONPOST.COM
Twitter nixes a handful of accounts pretending to be happy Amazon workers",2021-04-03 19:00:17,,,,,69,6,20,https://facebook.com/seiu/posts/10157632741842680,https://wapo.st/3wjuWji,19972147679,SEIU,False,[]
24,https://www.facebook.com/U.S.PIRG,uspirg,Organizations,Consumer Advocates,,N,Facebook,10158899131748080,"If antibiotics are no longer effective, it will have devastating consequences for human health. It's crucial that our leaders mitigate this growing threat by putting a stop to the overuse of medically important antibiotics in food animal production.

USPIRG.WEBACTION.ORG
Tell Congress: Take action to stop the dangerous overuse of antibiotics in animal agriculture.","If antibiotics are no longer effective, it will have devastating consequences for human health. It's crucial that our leaders mitigate this growing threat by putting a stop to the overuse of medically important antibiotics in food animal production.","USPIRG.WEBACTION.ORG
Tell Congress: Take action to stop the dangerous overuse of antibiotics in animal agriculture.",2021-04-03 17:23:31,,,,,11,0,0,https://facebook.com/uspirg/posts/10158899131748080,https://uspirg.webaction.org/p/dia/action4/common/public/?action_KEY=43117,11162728079,U.S. PIRG,False,[]
15,https://www.facebook.com/AARPpolicy,aarp,Organizations,Aging Organizations,,Y,Facebook,10159452549678960,"Fish, bacon, garlic — it turns out some of the best-tasting foods can make your kitchen smell less than fresh. Here are some tips for stomping out the stench from a few cleaning experts and a personal chefs.

AARP.ORG
6 Ways to Get Rid of Odors in Your Kitchen","Fish, bacon, garlic — it turns out some of the best-tasting foods can make your kitchen smell less than fresh. Here are some tips for stomping out the stench from a few cleaning experts and a personal chefs.","AARP.ORG
6 Ways to Get Rid of Odors in Your Kitchen",2021-04-03 16:22:46,,,,,72,7,8,https://facebook.com/aarp/posts/10159452549678960,http://spr.ly/6187HxnwX,57259033959,AARP,False,[]
16,https://www.facebook.com/AARPpolicy,aarp,Organizations,Aging Organizations,,Y,Facebook,10159452396643960,"The stereotypes about Ernest Hemingway are many but there's plenty more to the man revealed by documentarian Ken Burns in his latest, ""Hemingway,"" airing next week. Here's a sneak peek.

AARP.ORG
Ken Burns Explores the Complexity of Ernest Hemingway","The stereotypes about Ernest Hemingway are many but there's plenty more to the man revealed by documentarian Ken Burns in his latest, ""Hemingway,"" airing next week. Here's a sneak peek.","AARP.ORG
Ken Burns Explores the Complexity of Ernest Hemingway",2021-04-03 15:13:52,,,,,293,9,35,https://facebook.com/aarp/posts/10159452396643960,http://spr.ly/6189HxVfR,57259033959,AARP,False,[]
47,https://www.facebook.com/SEIU,seiu,Organizations,Labor,,N,Facebook,10157636933857680,"Black voices are powerful. We rose up to elect pro-worker leaders and we'll do so again to fight voter suppression.

CNBC.COM
'There is no middle ground' — Black CEOs urge companies to oppose restrictive voting laws",Black voices are powerful. We rose up to elect pro-worker leaders and we'll do so again to fight voter suppression.,"CNBC.COM
'There is no middle ground' — Black CEOs urge companies to oppose restrictive voting laws",2021-04-03 15:00:16,,,,,95,17,24,https://facebook.com/seiu/posts/10157636933857680,https://cnb.cx/3wmmsrI,19972147679,SEIU,False,[]
29,https://www.facebook.com/milkeninstitute,milkeninstitute,Organizations,Foundations & Think Tanks ,,N,Facebook,10158046195092525,"“African Americans and Latinos typically receive delayed diagnoses of dementia and experience institutional and cultural barriers when seeking help.”

Executive director Nora Super outlines our recent report on improving health equity and reducing disparities in dementia care:

MILKENINSTITUTE.ORG
Improving Health Equity for Black and Latino Communities","“African Americans and Latinos typically receive delayed diagnoses of dementia and experience institutional and cultural barriers when seeking help.”

Executive director Nora Super outlines our recent report on improving health equity and reducing disparities in dementia care:","MILKENINSTITUTE.ORG
Improving Health Equity for Black and Latino Communities",2021-04-03 14:50:01,,,,,5,0,0,https://facebook.com/milkeninstitute/posts/10158046195092525,https://milkeninstitute.org/articles/health-equity-african-american-latino,48724667524,Milken Institute,False,[]
33,https://www.facebook.com/RANDCorporation,randcorporation,Organizations,Foundations & Think Tanks ,,N,Facebook,10159793168598676,"Educational attainment in the United States has become ""an arms race for those seeking upward mobility."" RAND experts explain.

RAND.ORG
Fortifying Education as a Pathway to the Middle Class","Educational attainment in the United States has become ""an arms race for those seeking upward mobility."" RAND experts explain.","RAND.ORG
Fortifying Education as a Pathway to the Middle Class",2021-04-03 14:30:04,,,,,24,1,4,https://facebook.com/randcorporation/posts/10159793168598676,https://www.rand.org/pubs/perspectives/PEA1141-2.html?utm_campaign=&utm_content=1617474602&utm_medium=rand_social&utm_source=facebook,55708608675,RAND Corporation,False,[]
17,https://www.facebook.com/AARPpolicy,aarp,Organizations,Aging Organizations,,Y,Facebook,10159452267578960,"It's not your imagination, the second dose of the COVID-19 vaccine can produce more intense side effects. Here's a look at why, plus what you can expect.

AARP.ORG
More Side Effects for Second Doses of COVID-19 Vaccine","It's not your imagination, the second dose of the COVID-19 vaccine can produce more intense side effects. Here's a look at why, plus what you can expect.","AARP.ORG
More Side Effects for Second Doses of COVID-19 Vaccine",2021-04-03 14:13:03,,,,,604,358,348,https://facebook.com/aarp/posts/10159452267578960,http://spr.ly/6185Hx8eF,57259033959,AARP,False,[]
