,org_url,handle,type,class,flag,priority,platform,post_id,text,post_text,shared_text,time,image,video,video_thumbnail,video_id,likes,comments,shares,post_url,link,user_id,username,is_live,images
18,https://www.facebook.com/AARPpolicy,aarp,Organizations,Aging Organizations,,Y,Facebook,10159452009968960,The best defense against fraud is you. Scam-proof your life by taking some time when setting up a new account to add two-step authentication. Make sure to check your credit report at least once a year to spot any mistakes and correct them so your good credit can remain intact.,The best defense against fraud is you. Scam-proof your life by taking some time when setting up a new account to add two-step authentication. Make sure to check your credit report at least once a year to spot any mistakes and correct them so your good credit can remain intact.,,2021-04-03 12:08:50,,https://video-iad3-2.xx.fbcdn.net/v/t42.1790-2/168887930_3675756415870588_7593171069232542723_n.mp4?_nc_cat=106&ccb=1-3&_nc_sid=985c63&efg=eyJ2ZW5jb2RlX3RhZyI6InN2ZV9zZCJ9&_nc_ohc=sfb2Qirgnp4AX8wWqQo&_nc_ht=video-iad3-2.xx&oh=2deeea76573891239333bb38ba30dc53&oe=606BB4D7,https://scontent-iad3-2.xx.fbcdn.net/v/t15.5256-10/cp0/e15/q65/s320x320/163889771_357542872239222_4551983885064031359_n.jpg?_nc_cat=100&ccb=1-3&_nc_sid=ccf8b3&_nc_ohc=BgqmxRyx0DUAX9sz0_W&_nc_ht=scontent-iad3-2.xx&tp=9&oh=267029645044cbc579964d055b0455a5&oe=608FAF1D,357542348905941,47,0,0,https://facebook.com/aarp/videos/357542348905941,,57259033959,AARP,False,[]
48,https://www.facebook.com/SEIU,seiu,Organizations,Labor,,N,Facebook,10157636614087680,"Corporate tax cuts don't create jobs; they create even richer CEOs. Pass it on.

THEINTERCEPT.COM
Big Chunks of Corporate Tax Cuts End Up in Executives’ Pockets",Corporate tax cuts don't create jobs; they create even richer CEOs. Pass it on.,"THEINTERCEPT.COM
Big Chunks of Corporate Tax Cuts End Up in Executives’ Pockets",2021-04-03 11:00:22,,,,,42,5,19,https://facebook.com/seiu/posts/10157636614087680,https://bit.ly/3mjwzJa,19972147679,SEIU,False,[]
21,https://www.facebook.com/NCOAging,ncoaging,Organizations,Aging Organizations,,Y,Facebook,3764918603563125,"Did you know #covid19 vaccines are free for everyone? If you're living in the United States the #vaccine is free for you, regardless of immigration or health insurance status. If you or you're loved one are about to get the vaccine, we've got answers to some frequently asked questions about the vaccine.
https://bit.ly/3cJKPrw

NCOA.ORG
COVID-19 Vaccines: What Seniors Need to Know","Did you know #covid19 vaccines are free for everyone? If you're living in the United States the #vaccine is free for you, regardless of immigration or health insurance status. If you or you're loved one are about to get the vaccine, we've got answers to some frequently asked questions about the vaccine.
https://bit.ly/3cJKPrw","NCOA.ORG
COVID-19 Vaccines: What Seniors Need to Know",2021-04-03 08:39:01,,,,,15,0,4,https://facebook.com/ncoaging/posts/3764918603563125,https://bit.ly/3cJKPrw,131217580266597,National Council on Aging,False,[]
49,https://www.facebook.com/SEIU,seiu,Organizations,Labor,,N,Facebook,10157635723267680,No thanks to going back to normal. We want to build something better.,No thanks to going back to normal. We want to build something better.,,2021-04-02 21:30:03,https://scontent-iad3-2.xx.fbcdn.net/v/t1.6435-9/168958452_10157635723277680_872084893992742401_n.png?_nc_cat=108&ccb=1-3&_nc_sid=da1649&_nc_ohc=3jb7-iqWJQIAX_h2AQO&_nc_ht=scontent-iad3-2.xx&oh=06599572556591798945fa20b8ce72bd&oe=6092585B,,,,107,9,0,https://facebook.com/seiu/posts/10157635723267680,,19972147679,SEIU,False,"['https://scontent-iad3-2.xx.fbcdn.net/v/t1.6435-9/168958452_10157635723277680_872084893992742401_n.png?_nc_cat=108&ccb=1-3&_nc_sid=da1649&_nc_ohc=3jb7-iqWJQIAX_h2AQO&_nc_ht=scontent-iad3-2.xx&oh=06599572556591798945fa20b8ce72bd&oe=6092585B', 'https://scontent-iad3-2.xx.fbcdn.net/v/t1.6435-9/168958452_10157635723277680_872084893992742401_n.png?_nc_cat=108&ccb=1-3&_nc_sid=da1649&_nc_ohc=3jb7-iqWJQIAX_h2AQO&_nc_ht=scontent-iad3-2.xx&oh=06599572556591798945fa20b8ce72bd&oe=6092585B', 'https://scontent-iad3-2.xx.fbcdn.net/v/t1.6435-9/168958452_10157635723277680_872084893992742401_n.png?_nc_cat=108&ccb=1-3&_nc_sid=da1649&_nc_ohc=3jb7-iqWJQIAX_h2AQO&_nc_ht=scontent-iad3-2.xx&oh=06599572556591798945fa20b8ce72bd&oe=6092585B']"
