,org_url,handle,type,class,flag,priority,platform,post_id,text,post_text,shared_text,time,image,video,video_thumbnail,video_id,likes,comments,shares,post_url,link,user_id,username,is_live,images
23,https://www.facebook.com/U.S.PIRG,uspirg,Organizations,Consumer Advocates,,N,Facebook,10158915385858080,"Another face of clean beauty advocates who are helping consumers make safe cosmetic choices: beauty bloggers. This week, we spoke with @JemayWard, who is making a name for herself by blogging about toxic-free and clean beauty! https://uspirg.org/blogs/blog/usp/another-face-toxic-free-beauty-advocacy

USPIRG.ORG
Another face of toxic-free beauty advocacy | U.S. PIRG","Another face of clean beauty advocates who are helping consumers make safe cosmetic choices: beauty bloggers. This week, we spoke with @JemayWard, who is making a name for herself by blogging about toxic-free and clean beauty! https://uspirg.org/blogs/blog/usp/another-face-toxic-free-beauty-advocacy","USPIRG.ORG
Another face of toxic-free beauty advocacy | U.S. PIRG",2021-04-05 17:39:03,,,,,0,0,0,https://facebook.com/uspirg/posts/10158915385858080,https://uspirg.org/blogs/blog/usp/another-face-toxic-free-beauty-advocacy,11162728079,U.S. PIRG,False,[]
30,https://www.facebook.com/TheSCANFndtn,thescanfndtn,Organizations,Foundations & Think Tanks ,,N,Facebook,4160764597268884,"Nearly 1,000 #Medicare Advantage (MA) plans offer Special Supplemental Benefits for the Chronically Ill (SSBCI) in 2021, but there’s more to be done. ATI Advisory outlines the fives essential steps MA plans should take to expand SSBCI, helping address social determinants of health. https://bit.ly/3cv9QGH

BETTERCAREPLAYBOOK.ORG
A Roadmap for Health Plans to Provide Special Supplemental Benefits to Medicare Advantage Members | Playbook","Nearly 1,000 #Medicare Advantage (MA) plans offer Special Supplemental Benefits for the Chronically Ill (SSBCI) in 2021, but there’s more to be done. ATI Advisory outlines the fives essential steps MA plans should take to expand SSBCI, helping address social determinants of health. https://bit.ly/3cv9QGH","BETTERCAREPLAYBOOK.ORG
A Roadmap for Health Plans to Provide Special Supplemental Benefits to Medicare Advantage Members | Playbook",2021-04-05 17:38:38,,,,,1,0,0,https://facebook.com/thescanfndtn/posts/4160764597268884,https://bit.ly/3cv9QGH,147552491923468,The SCAN Foundation,False,[]
25,https://www.facebook.com/PHInational,phinational,Organizations,Foundations & Think Tanks ,,N,Facebook,10157480134785583,"""Demand for these services is increasing. Home-health aides and personal-care aides make up the sixth-fastest growing occupation in the country, according to Labor Department data, and pay about $12.15 per hour, or $25,280 per year. In many areas that’s not enough: Most home-health aides qualify for federal help like food assistance and Medicaid, research by PHI shows.""

ABOUT.BGOV.COM
HEALTH CARE BRIEFING: Biden Boosts Home Health in Economic Plan | Bloomberg Government","""Demand for these services is increasing. Home-health aides and personal-care aides make up the sixth-fastest growing occupation in the country, according to Labor Department data, and pay about $12.15 per hour, or $25,280 per year. In many areas that’s not enough: Most home-health aides qualify for federal help like food assistance and Medicaid, research by PHI shows.""","ABOUT.BGOV.COM
HEALTH CARE BRIEFING: Biden Boosts Home Health in Economic Plan | Bloomberg Government",2021-04-05 17:02:32,,,,,1,0,0,https://facebook.com/phinational/posts/10157480134785583,https://about.bgov.com/news/health-care-briefing-biden-boosts-home-health-in-economic-plan/,127691390582,PHI,False,[]
34,https://www.facebook.com/NAHCA,nahca,Organizations,Labor,,N,Facebook,10157875888216475,"We will be talking to and hearing from legislators during our virtual CNA March on Washington this Wednesday. Among those who will be addressing CNAs is NJ Rep. Andy Kim. Sign up for this important event and hear what he and others have to say about the challenges CNAs face, what the future may bring, and how we can work with legislators and others to reach our goals.","We will be talking to and hearing from legislators during our virtual CNA March on Washington this Wednesday. Among those who will be addressing CNAs is NJ Rep. Andy Kim. Sign up for this important event and hear what he and others have to say about the challenges CNAs face, what the future may bring, and how we can work with legislators and others to reach our goals.",,2021-04-05 17:00:43,https://scontent-iad3-2.xx.fbcdn.net/v/t1.6435-9/fr/cp0/e15/q65/169364429_10157875887756475_1368943579956801492_n.jpg?_nc_cat=100&ccb=1-3&_nc_sid=8024bb&_nc_ohc=svQbHPBIhqEAX9IRdYH&_nc_ht=scontent-iad3-2.xx&tp=14&oh=f3dff3ccdc3fa2e0f3d02ba8ffe85725&oe=60920196,,,,0,0,0,https://facebook.com/nahca/posts/10157875888216475,,345843311474,National Association of Health Care Assistants,False,['https://scontent-iad3-2.xx.fbcdn.net/v/t1.6435-9/fr/cp0/e15/q65/169364429_10157875887756475_1368943579956801492_n.jpg?_nc_cat=100&ccb=1-3&_nc_sid=8024bb&_nc_ohc=svQbHPBIhqEAX9IRdYH&_nc_ht=scontent-iad3-2.xx&tp=14&oh=f3dff3ccdc3fa2e0f3d02ba8ffe85725&oe=60920196']
2,https://www.facebook.com/AARPpolicy,aarp,Organizations,Aging Organizations,,Y,Facebook,10159457510168960,"After stepping on a roadside bomb in Afghanistan, retired Staff Sgt. Chaz Allen lost both of his legs. Since then, his daughter Deryn has made it her mission to help care for her dad. The two are featured in the documentary ""Sky Blossom"" — an AARP Movies For Grownups nominee highlighting young caregivers","After stepping on a roadside bomb in Afghanistan, retired Staff Sgt. Chaz Allen lost both of his legs. Since then, his daughter Deryn has made it her mission to help care for her dad. The two are featured in the documentary ""Sky Blossom"" — an AARP Movies For Grownups nominee highlighting young caregivers",,2021-04-05 16:20:10,,https://video-iad3-2.xx.fbcdn.net/v/t42.1790-2/169550057_1218038791927676_2604326015262009888_n.mp4?_nc_cat=102&ccb=1-3&_nc_sid=985c63&efg=eyJ2ZW5jb2RlX3RhZyI6InN2ZV9zZCJ9&_nc_ohc=MTFKQdGX1xkAX9YDab2&_nc_ht=video-iad3-2.xx&oh=a56b73b0976545d67e5942ce3c6d9337&oe=606BB1FB,https://scontent-iad3-2.xx.fbcdn.net/v/t15.5256-10/cp0/e15/q65/p320x320/165276274_363451511560443_6761326785552519185_n.jpg?_nc_cat=1&ccb=1-3&_nc_sid=ccf8b3&_nc_ohc=x23FkQHHIkcAX_ourrW&_nc_ht=scontent-iad3-2.xx&tp=3&oh=03e90e3c2fba8c17c16d903206d3be0d&oe=6090759B,363450611560533,132,18,0,https://facebook.com/aarp/videos/363450611560533,,57259033959,AARP,False,[]
39,https://www.facebook.com/SEIU,seiu,Organizations,Labor,,N,Facebook,10157641208517680,"No one should earn billions of dollars, while letting their employees struggle without a living wage! It’s time to respect us, protect us and pay us.","No one should earn billions of dollars, while letting their employees struggle without a living wage! It’s time to respect us, protect us and pay us.",,2021-04-05 16:00:17,https://scontent-iad3-2.xx.fbcdn.net/v/t1.6435-9/169989991_10157641208522680_676885830412919505_n.png?_nc_cat=100&ccb=1-3&_nc_sid=da1649&_nc_ohc=hysYXDljiisAX_YLSS5&_nc_ht=scontent-iad3-2.xx&oh=eff6b39f13ad8b9ebdc0f11507a1aed9&oe=60903EDE,,,,49,8,0,https://facebook.com/seiu/posts/10157641208517680,,19972147679,SEIU,False,"['https://scontent-iad3-2.xx.fbcdn.net/v/t1.6435-9/169989991_10157641208522680_676885830412919505_n.png?_nc_cat=100&ccb=1-3&_nc_sid=da1649&_nc_ohc=hysYXDljiisAX_YLSS5&_nc_ht=scontent-iad3-2.xx&oh=eff6b39f13ad8b9ebdc0f11507a1aed9&oe=60903EDE', 'https://scontent-iad3-2.xx.fbcdn.net/v/t1.6435-9/169989991_10157641208522680_676885830412919505_n.png?_nc_cat=100&ccb=1-3&_nc_sid=da1649&_nc_ohc=hysYXDljiisAX_YLSS5&_nc_ht=scontent-iad3-2.xx&oh=eff6b39f13ad8b9ebdc0f11507a1aed9&oe=60903EDE', 'https://scontent-iad3-2.xx.fbcdn.net/v/t1.6435-9/169989991_10157641208522680_676885830412919505_n.png?_nc_cat=100&ccb=1-3&_nc_sid=da1649&_nc_ohc=hysYXDljiisAX_YLSS5&_nc_ht=scontent-iad3-2.xx&oh=eff6b39f13ad8b9ebdc0f11507a1aed9&oe=60903EDE']"
3,https://www.facebook.com/AARPpolicy,aarp,Organizations,Aging Organizations,,Y,Facebook,10159457403833960,"Every year, more than 1.6 million lost, stolen or delayed paper checks go uncashed to beneficiaries, which can be detrimental for veterans. See how a new VA program hopes to fix that by helping veterans set up payments for direct deposit.

AARP.ORG
New VA Program Helps Veterans Get Bank Accounts","Every year, more than 1.6 million lost, stolen or delayed paper checks go uncashed to beneficiaries, which can be detrimental for veterans. See how a new VA program hopes to fix that by helping veterans set up payments for direct deposit.","AARP.ORG
New VA Program Helps Veterans Get Bank Accounts",2021-04-05 15:33:00,,,,,56,2,3,https://facebook.com/aarp/posts/10159457403833960,http://spr.ly/6183HI3ft,57259033959,AARP,False,[]
4,https://www.facebook.com/AARPpolicy,aarp,Organizations,Aging Organizations,,Y,Facebook,10159457211798960,"The DOJ is warning of a new scam where fraudsters are asking people to complete a survey about a COVID-19 vaccine in exchange for cash, an iPad Pro or other prize. Here's what you need to know.

AARP.ORG
DOJ Warns Consumers of COVID-19 Vaccine Survey Scam","The DOJ is warning of a new scam where fraudsters are asking people to complete a survey about a COVID-19 vaccine in exchange for cash, an iPad Pro or other prize. Here's what you need to know.","AARP.ORG
DOJ Warns Consumers of COVID-19 Vaccine Survey Scam",2021-04-05 14:22:43,,,,,50,4,86,https://facebook.com/aarp/posts/10159457211798960,http://spr.ly/6184HIzbk,57259033959,AARP,False,[]
35,https://www.facebook.com/NAHCA,nahca,Organizations,Labor,,N,Facebook,10157875556886475,Calling all caregivers! Take this 5-minute survey to share your perspectives for a chance to win an Apple Watch! Go to https://www.surveymonkey.com/r/KN9J3HY for the survey. But don’t delay…the survey closes on April 15.,Calling all caregivers! Take this 5-minute survey to share your perspectives for a chance to win an Apple Watch! Go to https://www.surveymonkey.com/r/KN9J3HY for the survey. But don’t delay…the survey closes on April 15.,,2021-04-05 14:04:23,https://scontent-iad3-2.xx.fbcdn.net/v/t1.6435-9/169391508_10157875558611475_3322008189479483103_n.png?_nc_cat=101&ccb=1-3&_nc_sid=8024bb&_nc_ohc=9bxG4Pptg5oAX9jx2Dx&_nc_ht=scontent-iad3-2.xx&oh=3a9b93441c125f2f546e2f50f99bc5cb&oe=609011A5,,,,2,0,0,https://facebook.com/nahca/posts/10157875556886475,https://www.surveymonkey.com/r/KN9J3HY,345843311474,National Association of Health Care Assistants,False,['https://scontent-iad3-2.xx.fbcdn.net/v/t1.6435-9/169391508_10157875558611475_3322008189479483103_n.png?_nc_cat=101&ccb=1-3&_nc_sid=8024bb&_nc_ohc=9bxG4Pptg5oAX9jx2Dx&_nc_ht=scontent-iad3-2.xx&oh=3a9b93441c125f2f546e2f50f99bc5cb&oe=609011A5']
5,https://www.facebook.com/AARPpolicy,aarp,Organizations,Aging Organizations,,Y,Facebook,10159456867458960,These changes mean greater accessibility and affordability for Americans age 50-64. Get more details: http://spr.ly/6182HxpwY,These changes mean greater accessibility and affordability for Americans age 50-64. Get more details: http://spr.ly/6182HxpwY,,2021-04-05 13:03:03,,https://video-iad3-2.xx.fbcdn.net/v/t42.1790-2/168902020_816670805599558_6519511913037165802_n.mp4?_nc_cat=107&ccb=1-3&_nc_sid=985c63&efg=eyJ2ZW5jb2RlX3RhZyI6InN2ZV9zZCJ9&_nc_ohc=rcLfR-oY5iEAX_9ffBC&_nc_ht=video-iad3-2.xx&oh=5cfe5607bfe4bb37c9257ce99b8ed20a&oe=606BADA4,https://scontent-iad3-2.xx.fbcdn.net/v/t15.5256-10/cp0/e15/q65/s320x320/157793844_269195008204093_3776355014426385605_n.jpg?_nc_cat=102&ccb=1-3&_nc_sid=ccf8b3&_nc_ohc=jEEyIAS7RMIAX_NoyhL&_nc_ht=scontent-iad3-2.xx&tp=9&oh=f6acbeaa900e1680f8b25afe03d611db&oe=6091BD89,269283854861875,32,0,0,https://facebook.com/aarp/videos/269283854861875,http://spr.ly/6182HxpwY,57259033959,AARP,False,[]
27,https://www.facebook.com/milkeninstitute,milkeninstitute,Organizations,Foundations & Think Tanks ,,N,Facebook,10158051116232525,"After gaining six million users in under two months, Robinhood is looking to hire a significant number of new employees.

Learn more about the crypto app's rapid growth, plus Apple's issues with EU regulation, in the latest FinTech in Focus.

MILKENINSTITUTE.ORG
FinTech in Focus: Robinhood Expands; Apple Encounters EU Rules","After gaining six million users in under two months, Robinhood is looking to hire a significant number of new employees.

Learn more about the crypto app's rapid growth, plus Apple's issues with EU regulation, in the latest FinTech in Focus.","MILKENINSTITUTE.ORG
FinTech in Focus: Robinhood Expands; Apple Encounters EU Rules",2021-04-05 12:39:54,,,,,0,0,0,https://facebook.com/milkeninstitute/posts/10158051116232525,https://milkeninstitute.org/newsletter/fintech-focus-robinhood-apple,48724667524,Milken Institute,False,[]
40,https://www.facebook.com/SEIU,seiu,Organizations,Labor,,N,Facebook,10157640815017680,"""More than half of home-care workers are on some form of public assistance such as food stamps... They are overwhelmingly female and far more likely to be people of color than the general population.""

WASHINGTONPOST.COM
Biden jobs plan seeks $400 billion to expand caretaking services as U.S. faces surge in aging population","""More than half of home-care workers are on some form of public assistance such as food stamps... They are overwhelmingly female and far more likely to be people of color than the general population.""","WASHINGTONPOST.COM
Biden jobs plan seeks $400 billion to expand caretaking services as U.S. faces surge in aging population",2021-04-05 12:31:56,,,,,55,3,5,https://facebook.com/seiu/posts/10157640815017680,https://wapo.st/3sK3oBq,19972147679,SEIU,False,[]
6,https://www.facebook.com/AARPpolicy,aarp,Organizations,Aging Organizations,,Y,Facebook,10159456900913960,"Authorities are warning Twitter, Shopify and eBay after the platforms have been used to sell blank or fake COVID-19 vaccination cards. Here's how the companies plan to protect consumers.

AARP.ORG
Fake COVID-19 Vaccination Cards Put Public Health at Risk","Authorities are warning Twitter, Shopify and eBay after the platforms have been used to sell blank or fake COVID-19 vaccination cards. Here's how the companies plan to protect consumers.","AARP.ORG
Fake COVID-19 Vaccination Cards Put Public Health at Risk",2021-04-05 12:15:49,,,,,31,16,18,https://facebook.com/aarp/posts/10159456900913960,http://spr.ly/6184HIKaG,57259033959,AARP,False,[]
36,https://www.facebook.com/NAHCA,nahca,Organizations,Labor,,N,Facebook,10157875366061475,"We are excited to have Dr. Diane Sanders-Cepeda speaking at our virtual CNA March on Washington this Wednesday. In addition to being a post-acute and long-term care physician, she is a member of AMDA--The Society for Post-Acute and Long-Term Care Medicine's Diversity, Equity, and Inclusion Workgroup.","We are excited to have Dr. Diane Sanders-Cepeda speaking at our virtual CNA March on Washington this Wednesday. In addition to being a post-acute and long-term care physician, she is a member of AMDA--The Society for Post-Acute and Long-Term Care Medicine's Diversity, Equity, and Inclusion Workgroup.",,2021-04-05 12:12:34,https://scontent-iad3-2.xx.fbcdn.net/v/t1.6435-9/169591729_10157875360811475_4965647230057866313_n.png?_nc_cat=101&ccb=1-3&_nc_sid=8024bb&_nc_ohc=xUtaozmJ0P8AX_QeZ_7&_nc_oc=AQkQ4U2d66Ul19fTLIcSREj1SYswTBieUdOGixgZlkR5cwCCrof4v6cQWaQ6oJqelIA&_nc_ht=scontent-iad3-2.xx&oh=10af6cc7391bc9285eed01d50bf2b62c&oe=609197A4,,,,6,0,0,https://facebook.com/nahca/posts/10157875366061475,,345843311474,National Association of Health Care Assistants,False,['https://scontent-iad3-2.xx.fbcdn.net/v/t1.6435-9/169591729_10157875360811475_4965647230057866313_n.png?_nc_cat=101&ccb=1-3&_nc_sid=8024bb&_nc_ohc=xUtaozmJ0P8AX_QeZ_7&_nc_oc=AQkQ4U2d66Ul19fTLIcSREj1SYswTBieUdOGixgZlkR5cwCCrof4v6cQWaQ6oJqelIA&_nc_ht=scontent-iad3-2.xx&oh=10af6cc7391bc9285eed01d50bf2b62c&oe=609197A4']
0,https://www.facebook.com/NADSA2,nadsa2,Organizations,Orgs Representing Service Providers,,Y,Facebook,2529809193809450,"New Opportunities and New Dangers for Adult Day
Wednesday, May 5, 2021
1:00 pm EDT/ 12:00 noon CDT / 1:00 am MDT / 10:00 am PDT
NADSA Members: $49
Non-members: $149

www.nadsa.org

New opportunities arise with every change of Presidential administration and congressional leadership. They are tucked in among the massive confusion of personnel changes, new policy initiatives, executive orders, and media briefings. Join NADSA’s Public Policy Advisor Roy Afflerbach as he unpacks some of the changes that can provide opportunities and some of the dangers for adult day with a dive into Congressional reorganization, the American Recovery Act, the American Jobs Act, and initiatives undertaken by organizations with which NADSA collaborates or competes.

NADSA.ORG
National Adult Day Services Association: Innovation, Service, and Support - NADSA: adult day services","New Opportunities and New Dangers for Adult Day
Wednesday, May 5, 2021
1:00 pm EDT/ 12:00 noon CDT / 1:00 am MDT / 10:00 am PDT
NADSA Members: $49
Non-members: $149

www.nadsa.org

New opportunities arise with every change of Presidential administration and congressional leadership. They are tucked in among the massive confusion of personnel changes, new policy initiatives, executive orders, and media briefings. Join NADSA’s Public Policy Advisor Roy Afflerbach as he unpacks some of the changes that can provide opportunities and some of the dangers for adult day with a dive into Congressional reorganization, the American Recovery Act, the American Jobs Act, and initiatives undertaken by organizations with which NADSA collaborates or competes.","NADSA.ORG
National Adult Day Services Association: Innovation, Service, and Support - NADSA: adult day services",2021-04-05 11:58:16,,,,,0,0,0,https://facebook.com/nadsa2/posts/2529809193809450,http://www.nadsa.org/,157718607685199,National Adult Day Services Association,False,[]
1,https://www.facebook.com/NADSA2,nadsa2,Organizations,Orgs Representing Service Providers,,Y,Facebook,2529805100476526,"Utilizing Hybrid Technology to Re-open and Grow Your ADS Center Revenue
Wednesday, April 21, 2021
1:00 pm EDT/ 12:00 noon CDT / 1:00 am MDT / 10:00 am PDT
NADSA Members: $49
Non-members: $149

www.nadsa.org

Virtual Adult Day services has shown great promise in retaining membership and bringing cost-effective ADS operations to centers that are confronting staff shortage and closure. As re-opening is on the horizon in many states, centers are facing the irony that members will not return to the center 100%. The legacy of the pandemic for a hybrid model of “Virtual + Physical” deliveries is here to stay.

HealthJay, a NADSA Strategic Partner, is partnering with NADSA to offer the “Hybrid ToolBox” that supports virtual programming, virtual and physical attendance check-in, integrated activity scheduling and enrollment, and electronic validation of remote services.

Objectives of this session include:

Overview of “why this is important.” HealthJay’s founders and center executives will talk about why Hybrid ADS is a demonstration of value-based services and how hybrid technology will benefit Adult Day centers.
Highlight how Hybrid ADS sets the stage for Person-Centered Care that Adult Day stakeholders (CMS, MCOs and various Payers) use as a benchmark for reimbursement
Answer: ‘What’s in it?” for providers and the Adult Day Service Sector. How will the Hybrid ToolBox be a “Revenue Generator” instead of “Another Tech” that costs money.
Explanation of how Hybrid models, by using data collection, is the pathway for real revenue growth and membership sustainability after many immediate fixes of using virtual programming during the pandemic.
Operationalize a dual model of Adult Day service delivery by having a data collection and management platform.
Learn about the Hybrid Checklist that ADS center executives should know as we plan for re-opening.
About the presenters:

Rosita Wong is the Co-Founder and CEO of HealthJay Inc. HealthJay brings Hybrid Solutions to non-tech-savvy clients and the care workforce with its “Zero-Barrier” Suite of Apps. The company’s integrated solutions have been adopted by organizations in the Adult Day, Home Health, and Senior Living communities. Schedule a demo with HealthJay at www.healthjay.com.","Utilizing Hybrid Technology to Re-open and Grow Your ADS Center Revenue
Wednesday, April 21, 2021
1:00 pm EDT/ 12:00 noon CDT / 1:00 am MDT / 10:00 am PDT
NADSA Members: $49
Non-members: $149

www.nadsa.org

Virtual Adult Day services has shown great promise in retaining membership and bringing cost-effective ADS operations to centers that are confronting staff shortage and closure. As re-opening is on the horizon in many states, centers are facing the irony that members will not return to the center 100%. The legacy of the pandemic for a hybrid model of “Virtual + Physical” deliveries is here to stay.

HealthJay, a NADSA Strategic Partner, is partnering with NADSA to offer the “Hybrid ToolBox” that supports virtual programming, virtual and physical attendance check-in, integrated activity scheduling and enrollment, and electronic validation of remote services.

Objectives of this session include:

Overview of “why this is important.” HealthJay’s founders and center executives will talk about why Hybrid ADS is a demonstration of value-based services and how hybrid technology will benefit Adult Day centers.
Highlight how Hybrid ADS sets the stage for Person-Centered Care that Adult Day stakeholders (CMS, MCOs and various Payers) use as a benchmark for reimbursement
Answer: ‘What’s in it?” for providers and the Adult Day Service Sector. How will the Hybrid ToolBox be a “Revenue Generator” instead of “Another Tech” that costs money.
Explanation of how Hybrid models, by using data collection, is the pathway for real revenue growth and membership sustainability after many immediate fixes of using virtual programming during the pandemic.
Operationalize a dual model of Adult Day service delivery by having a data collection and management platform.
Learn about the Hybrid Checklist that ADS center executives should know as we plan for re-opening.
About the presenters:

Rosita Wong is the Co-Founder and CEO of HealthJay Inc. HealthJay brings Hybrid Solutions to non-tech-savvy clients and the care workforce with its “Zero-Barrier” Suite of Apps. The company’s integrated solutions have been adopted by organizations in the Adult Day, Home Health, and Senior Living communities. Schedule a demo with HealthJay at www.healthjay.com.",,2021-04-05 11:56:20,,,,,2,0,0,https://facebook.com/nadsa2/posts/2529805100476526,http://www.nadsa.org/,157718607685199,National Adult Day Services Association,False,[]
7,https://www.facebook.com/AARPpolicy,aarp,Organizations,Aging Organizations,,Y,Facebook,10159456819298960,"The billions of cicadas about to emerge from their 17-year slumber will intrigue your dog, but canines shouldn’t chow down. Here's how to help your dog avoid these tasty insects and prevent a tummy ache.

AARP.ORG
Keep Your Pet Dog Safe From Cicada Insects","The billions of cicadas about to emerge from their 17-year slumber will intrigue your dog, but canines shouldn’t chow down. Here's how to help your dog avoid these tasty insects and prevent a tummy ache.","AARP.ORG
Keep Your Pet Dog Safe From Cicada Insects",2021-04-05 11:29:04,,,,,80,15,178,https://facebook.com/aarp/posts/10159456819298960,http://spr.ly/6182HIKUy,57259033959,AARP,False,[]
37,https://www.facebook.com/NAHCA,nahca,Organizations,Labor,,N,Facebook,10157875259656475,"We are so pleased to have Susan Ryan, senior director of The Green House Project, speaking at our virtual CNA March on Washington this Wednesday. Join us to hear her, other industry leaders, legislators, celebrities, and many of your NAHCA friends and colleagues. https://www.nahcacna.org/cna-virtual-march-on-washington/.","We are so pleased to have Susan Ryan, senior director of The Green House Project, speaking at our virtual CNA March on Washington this Wednesday. Join us to hear her, other industry leaders, legislators, celebrities, and many of your NAHCA friends and colleagues. https://www.nahcacna.org/cna-virtual-march-on-washington/.",,2021-04-05 10:59:51,https://scontent-iad3-2.xx.fbcdn.net/v/t1.6435-9/169617765_10157875259421475_303850068393550770_n.png?_nc_cat=100&ccb=1-3&_nc_sid=8024bb&_nc_ohc=2eMEkBMn4IEAX_GWMyW&_nc_ht=scontent-iad3-2.xx&oh=dac94110f02139edb338e33d0dbaac61&oe=608FCBAC,,,,1,0,0,https://facebook.com/nahca/posts/10157875259656475,https://www.nahcacna.org/cna-virtual-march-on-washington/,345843311474,National Association of Health Care Assistants,False,['https://scontent-iad3-2.xx.fbcdn.net/v/t1.6435-9/169617765_10157875259421475_303850068393550770_n.png?_nc_cat=100&ccb=1-3&_nc_sid=8024bb&_nc_ohc=2eMEkBMn4IEAX_GWMyW&_nc_ht=scontent-iad3-2.xx&oh=dac94110f02139edb338e33d0dbaac61&oe=608FCBAC']
22,https://www.facebook.com/LTCCC,ltcconsumer,Organizations,Consumer Advocates,,N,Facebook,5756016184439157,"You've Got Mail!

LTCCONSUMER.COM
Reconnect with Loved Ones Using Letter Writing Services | LTC Consumer",You've Got Mail!,"LTCCONSUMER.COM
Reconnect with Loved Ones Using Letter Writing Services | LTC Consumer",2021-04-05 10:34:44,,,,,0,0,0,https://facebook.com/ltcconsumer/posts/5756016184439157,https://ltcconsumer.com/newsletter/reconnect-loved-ones-using-letter-writing-services,797319953642163,LTC Consumer,False,[]
