,org_url,handle,type,class,flag,priority,platform,url,photos,date,content,renderedContent,id,user,outlinks,tcooutlinks,replyCount,retweetCount,likeCount,quoteCount,conversationId,lang,source,sourceUrl,sourceLabel,media,retweetedTweet,quotedTweet,mentionedUsers,pullStart,pullEnd,profileImage,displayName,fixedUser
152,https://twitter.com/nexusinsights,nexusinsights,Organizations,Foundations & Think Tanks ,,N,Twitter,https://twitter.com/NexusInsights/status/1380259664378617864,,2021-04-08 20:42:02+00:00,"We saw a lot of staff decline the #vaccine at the first visit but then choose to do it at the latter clinics,” said @DavidCGrabowski. But once #nursinghomes have had their three clinics, “there's no [federal] plan to circle back"" @AARP #NexusFellows https://t.co/tcBlUBEz0u","We saw a lot of staff decline the #vaccine at the first visit but then choose to do it at the latter clinics,” said @DavidCGrabowski. But once #nursinghomes have had their three clinics, “there's no [federal] plan to circle back"" @AARP #NexusFellows bit.ly/3t4d89N",1380259664378617864,"{'username': 'NexusInsights', 'displayname': 'Nexus Insights', 'id': 1255595500457394178, 'description': 'Nexus Insights leverages a network of leading thinkers and thinking leaders to develop provocative ideas and new models for the future of aging services.', 'rawDescription': 'Nexus Insights leverages a network of leading thinkers and thinking leaders to develop provocative ideas and new models for the future of aging services.', 'descriptionUrls': [], 'verified': False, 'created': datetime.datetime(2020, 4, 29, 20, 32, 50, tzinfo=datetime.timezone.utc), 'followersCount': 79, 'friendsCount': 102, 'statusesCount': 190, 'favouritesCount': 48, 'listedCount': 2, 'mediaCount': 30, 'location': '', 'protected': False, 'linkUrl': 'https://www.nexusinsights.net/', 'linkTcourl': 'https://t.co/LGQJOWykzj', 'profileImageUrl': 'https://pbs.twimg.com/profile_images/1255596542322454534/_jrrAxkY_normal.jpg', 'profileBannerUrl': 'https://pbs.twimg.com/profile_banners/1255595500457394178/1612387476'}",['https://bit.ly/3t4d89N'],['https://t.co/tcBlUBEz0u'],0,0,0,0,1380259664378617864,en,"<a href=""https://mobile.twitter.com"" rel=""nofollow"">Twitter Web App</a>",https://mobile.twitter.com,Twitter Web App,,,,"[{'username': 'DavidCGrabowski', 'displayname': 'David Grabowski', 'id': 818526966349492224, 'description': None, 'rawDescription': None, 'descriptionUrls': None, 'verified': None, 'created': None, 'followersCount': None, 'friendsCount': None, 'statusesCount': None, 'favouritesCount': None, 'listedCount': None, 'mediaCount': None, 'location': None, 'protected': None, 'linkUrl': None, 'linkTcourl': None, 'profileImageUrl': None, 'profileBannerUrl': None}, {'username': 'AARP', 'displayname': 'AARP', 'id': 80628196, 'description': None, 'rawDescription': None, 'descriptionUrls': None, 'verified': None, 'created': None, 'followersCount': None, 'friendsCount': None, 'statusesCount': None, 'favouritesCount': None, 'listedCount': None, 'mediaCount': None, 'location': None, 'protected': None, 'linkUrl': None, 'linkTcourl': None, 'profileImageUrl': None, 'profileBannerUrl': None}]",2021-04-07 16:45:13.411339,2021-04-08 16:45:13.411339,,,
205,https://twitter.com/seiu,seiu,Organizations,Labor,,N,Twitter,https://twitter.com/SEIU/status/1380256676872396800,,2021-04-08 20:30:10+00:00,"No more exploitation. Unions. For. All. 

Solidarity with all @BAmazonworkers! ✊🏿✊🏽✊🏻

#UnionsForAll #ProtectAllWorkers #1u #UnionStrong #UnionYes
https://t.co/uciG1HUlOZ","No more exploitation. Unions. For. All. 

Solidarity with all @BAmazonworkers! ✊🏿✊🏽✊🏻

#UnionsForAll #ProtectAllWorkers #1u #UnionStrong #UnionYes
cnbc.com/2021/04/08/ama…",1380256676872396800,"{'username': 'SEIU', 'displayname': 'SEIU', 'id': 14695985, 'description': 'Service Employees International Union: 2M working people united for dignity, justice and a better life.', 'rawDescription': 'Service Employees International Union: 2M working people united for dignity, justice and a better life.', 'descriptionUrls': [], 'verified': True, 'created': datetime.datetime(2008, 5, 8, 4, 8, 6, tzinfo=datetime.timezone.utc), 'followersCount': 103529, 'friendsCount': 10992, 'statusesCount': 56645, 'favouritesCount': 8139, 'listedCount': 2207, 'mediaCount': 15808, 'location': 'U.S., Canada, Puerto Rico', 'protected': False, 'linkUrl': 'http://www.seiu.org', 'linkTcourl': 'https://t.co/cqohIfQC5Y', 'profileImageUrl': 'https://pbs.twimg.com/profile_images/1366819232558829569/Ui1lol4U_normal.png', 'profileBannerUrl': 'https://pbs.twimg.com/profile_banners/14695985/1614814553'}",['https://www.cnbc.com/2021/04/08/amazon-union-drive-in-alabama-sees-55percent-voter-turnout.html'],['https://t.co/uciG1HUlOZ'],0,2,10,0,1380256676872396800,en,"<a href=""https://sproutsocial.com"" rel=""nofollow"">Sprout Social</a>",https://sproutsocial.com,Sprout Social,,,,,2021-04-07 16:45:13.411339,2021-04-08 16:45:13.411339,,,
206,https://twitter.com/seiu,seiu,Organizations,Labor,,N,Twitter,https://twitter.com/SEIU/status/1380256674481586182,,2021-04-08 20:30:09+00:00,"Billionaires rig the system to get rich, then use their wealth &amp; power to keep us underpaid and in poverty. Uniting in our union is the best way to fight back. 

#RaiseTheWage #UnionsForAll #RespectProtectPayUs #Billionaires #JeffBezos #ElonMusk #BillGates https://t.co/A4Y9yoEN7F","Billionaires rig the system to get rich, then use their wealth &amp; power to keep us underpaid and in poverty. Uniting in our union is the best way to fight back. 

#RaiseTheWage #UnionsForAll #RespectProtectPayUs #Billionaires #JeffBezos #ElonMusk #BillGates washingtonpost.com/business/2021/…",1380256674481586182,"{'username': 'SEIU', 'displayname': 'SEIU', 'id': 14695985, 'description': 'Service Employees International Union: 2M working people united for dignity, justice and a better life.', 'rawDescription': 'Service Employees International Union: 2M working people united for dignity, justice and a better life.', 'descriptionUrls': [], 'verified': True, 'created': datetime.datetime(2008, 5, 8, 4, 8, 6, tzinfo=datetime.timezone.utc), 'followersCount': 103529, 'friendsCount': 10992, 'statusesCount': 56645, 'favouritesCount': 8139, 'listedCount': 2207, 'mediaCount': 15808, 'location': 'U.S., Canada, Puerto Rico', 'protected': False, 'linkUrl': 'http://www.seiu.org', 'linkTcourl': 'https://t.co/cqohIfQC5Y', 'profileImageUrl': 'https://pbs.twimg.com/profile_images/1366819232558829569/Ui1lol4U_normal.png', 'profileBannerUrl': 'https://pbs.twimg.com/profile_banners/14695985/1614814553'}",['https://www.washingtonpost.com/business/2021/04/06/billionaire-wealth-forbes-pandemic/'],['https://t.co/A4Y9yoEN7F'],0,1,5,0,1380256674481586182,en,"<a href=""https://sproutsocial.com"" rel=""nofollow"">Sprout Social</a>",https://sproutsocial.com,Sprout Social,,,,,2021-04-07 16:45:13.411339,2021-04-08 16:45:13.411339,,,
253,https://twitter.com/wassdoc,wassdoc,Individual,Organization Leader,,Y,Twitter,https://twitter.com/wassdoc/status/1380255213903224834,,2021-04-08 20:24:21+00:00,This! https://t.co/peFlY2gs0M,This! twitter.com/davidcgrabowsk…,1380255213903224834,"{'username': 'wassdoc', 'displayname': 'Mike Wasserman', 'id': 181280675, 'description': 'Grampa, husband, dad, ironman, geriatrician', 'rawDescription': 'Grampa, husband, dad, ironman, geriatrician', 'descriptionUrls': [], 'verified': False, 'created': datetime.datetime(2010, 8, 21, 19, 55, 18, tzinfo=datetime.timezone.utc), 'followersCount': 2434, 'friendsCount': 747, 'statusesCount': 20975, 'favouritesCount': 42931, 'listedCount': 98, 'mediaCount': 361, 'location': 'Thousand Oaks, CA', 'protected': False, 'linkUrl': None, 'linkTcourl': None, 'profileImageUrl': 'https://pbs.twimg.com/profile_images/1314731957343846401/zT2y7Gir_normal.jpg', 'profileBannerUrl': None}",['https://twitter.com/davidcgrabowski/status/1380248434779815938'],['https://t.co/peFlY2gs0M'],0,1,1,0,1380255213903224834,en,"<a href=""http://twitter.com/download/iphone"" rel=""nofollow"">Twitter for iPhone</a>",http://twitter.com/download/iphone,Twitter for iPhone,,,"{'url': 'https://twitter.com/DavidCGrabowski/status/1380248434779815938', 'date': datetime.datetime(2021, 4, 8, 19, 57, 25, tzinfo=datetime.timezone.utc), 'content': 'Covid cases and deaths continue to decline among nursing home residents (!!!). Unfortunately, nursing home staff cases have leveled out over past five weeks. Need to continue vaccination efforts. https://t.co/KOeMJrWcCh', 'renderedContent': 'Covid cases and deaths continue to decline among nursing home residents (!!!). Unfortunately, nursing home staff cases have leveled out over past five weeks. Need to continue vaccination efforts. https://t.co/KOeMJrWcCh', 'id': 1380248434779815938, 'user': {'username': 'DavidCGrabowski', 'displayname': 'David Grabowski', 'id': 818526966349492224, 'description': 'Professor, Health Care Policy, Harvard Medical School -- health economics, aging, long-term care, post-acute care', 'rawDescription': 'Professor, Health Care Policy, Harvard Medical School -- health economics, aging, long-term care, post-acute care', 'descriptionUrls': [], 'verified': False, 'created': datetime.datetime(2017, 1, 9, 18, 36, 51, tzinfo=datetime.timezone.utc), 'followersCount': 7674, 'friendsCount': 983, 'statusesCount': 3619, 'favouritesCount': 9764, 'listedCount': 158, 'mediaCount': 272, 'location': 'Boston, MA', 'protected': False, 'linkUrl': 'https://hcp.hms.harvard.edu/people/david-c-grabowski', 'linkTcourl': 'https://t.co/WiO1ez95qr', 'profileImageUrl': 'https://pbs.twimg.com/profile_images/818574173404622854/u6wS33TE_normal.jpg', 'profileBannerUrl': 'https://pbs.twimg.com/profile_banners/818526966349492224/1483997670'}, 'outlinks': [], 'tcooutlinks': [], 'replyCount': 1, 'retweetCount': 2, 'likeCount': 10, 'quoteCount': 3, 'conversationId': 1380248434779815938, 'lang': 'en', 'source': '<a href=""https://mobile.twitter.com"" rel=""nofollow"">Twitter Web App</a>', 'sourceUrl': 'https://mobile.twitter.com', 'sourceLabel': 'Twitter Web App', 'media': [{'previewUrl': 'https://pbs.twimg.com/media/EyefrFmWYAATJLi?format=jpg&name=small', 'fullUrl': 'https://pbs.twimg.com/media/EyefrFmWYAATJLi?format=jpg&name=large', 'type': 'photo'}], 'retweetedTweet': None, 'quotedTweet': None, 'mentionedUsers': None}",,2021-04-07 16:45:13.411339,2021-04-08 16:45:13.411339,,,
83,https://twitter.com/uspirg,uspirg,Organizations,Consumer Advocates,,N,Twitter,https://twitter.com/uspirg/status/1380255034806505476,,2021-04-08 20:23:38+00:00,We agree with @SecretaryPete -- getting our kids to school shouldn't include a daily dose of toxic pollution or make the climate crisis worse.  #ElectricBuses4America https://t.co/kqeTOJgL0e,We agree with @SecretaryPete -- getting our kids to school shouldn't include a daily dose of toxic pollution or make the climate crisis worse.  #ElectricBuses4America twitter.com/SecretaryPete/…,1380255034806505476,"{'username': 'uspirg', 'displayname': 'U.S. PIRG', 'id': 42660729, 'description': 'U.S. PIRG, the United States Public Interest Research Group, is a state-based, citizen-funded advocacy group that promotes the public interest.', 'rawDescription': 'U.S. PIRG, the United States Public Interest Research Group, is a state-based, citizen-funded advocacy group that promotes the public interest.', 'descriptionUrls': [], 'verified': True, 'created': datetime.datetime(2009, 5, 26, 16, 34, 32, tzinfo=datetime.timezone.utc), 'followersCount': 9760, 'friendsCount': 3481, 'statusesCount': 14435, 'favouritesCount': 1327, 'listedCount': 524, 'mediaCount': 3837, 'location': 'United States', 'protected': False, 'linkUrl': 'http://www.uspirg.org', 'linkTcourl': 'https://t.co/iGmfe4F3pU', 'profileImageUrl': 'https://pbs.twimg.com/profile_images/1255161973588684802/4i5e4Mpv_normal.png', 'profileBannerUrl': 'https://pbs.twimg.com/profile_banners/42660729/1430156203'}",['https://twitter.com/SecretaryPete/status/1380159510069837824'],['https://t.co/kqeTOJgL0e'],0,0,1,0,1380255034806505476,en,"<a href=""https://about.twitter.com/products/tweetdeck"" rel=""nofollow"">TweetDeck</a>",https://about.twitter.com/products/tweetdeck,TweetDeck,,,"{'url': 'https://twitter.com/SecretaryPete/status/1380159510069837824', 'date': datetime.datetime(2021, 4, 8, 14, 4, 3, tzinfo=datetime.timezone.utc), 'content': 'Electrified school buses lead to a cleaner planet, healthier children, and new, good-paying jobs.\n\nNot bad!\nhttps://t.co/6RwTrfP9t1', 'renderedContent': 'Electrified school buses lead to a cleaner planet, healthier children, and new, good-paying jobs.\n\nNot bad!\nvox.com/future-perfect…', 'id': 1380159510069837824, 'user': {'username': 'SecretaryPete', 'displayname': 'Secretary Pete Buttigieg', 'id': 1356958547603513346, 'description': '19th Secretary of Transportation. Working to ensure safety and make transportation more equitable while fighting climate change and creating jobs. (he/him)', 'rawDescription': '19th Secretary of Transportation. Working to ensure safety and make transportation more equitable while fighting climate change and creating jobs. (he/him)', 'descriptionUrls': [], 'verified': True, 'created': datetime.datetime(2021, 2, 3, 13, 32, 51, tzinfo=datetime.timezone.utc), 'followersCount': 245556, 'friendsCount': 115, 'statusesCount': 284, 'favouritesCount': 82, 'listedCount': 917, 'mediaCount': 49, 'location': 'Washington, D.C.', 'protected': False, 'linkUrl': 'http://transportation.gov', 'linkTcourl': 'https://t.co/gwIk6ANQ0H', 'profileImageUrl': 'https://pbs.twimg.com/profile_images/1356958934532304903/muuwKYND_normal.jpg', 'profileBannerUrl': 'https://pbs.twimg.com/profile_banners/1356958547603513346/1612360006'}, 'outlinks': ['https://www.vox.com/future-perfect/2021/4/6/22364385/one-small-idea-in-bidens-infrastructure-plan-with-big-benefits-electric-school-buses'], 'tcooutlinks': ['https://t.co/6RwTrfP9t1'], 'replyCount': 76, 'retweetCount': 407, 'likeCount': 3090, 'quoteCount': 37, 'conversationId': 1380159510069837824, 'lang': 'en', 'source': '<a href=""https://mobile.twitter.com"" rel=""nofollow"">Twitter Web App</a>', 'sourceUrl': 'https://mobile.twitter.com', 'sourceLabel': 'Twitter Web App', 'media': None, 'retweetedTweet': None, 'quotedTweet': None, 'mentionedUsers': None}","[{'username': 'SecretaryPete', 'displayname': 'Secretary Pete Buttigieg', 'id': 1356958547603513346, 'description': None, 'rawDescription': None, 'descriptionUrls': None, 'verified': None, 'created': None, 'followersCount': None, 'friendsCount': None, 'statusesCount': None, 'favouritesCount': None, 'listedCount': None, 'mediaCount': None, 'location': None, 'protected': None, 'linkUrl': None, 'linkTcourl': None, 'profileImageUrl': None, 'profileBannerUrl': None}]",2021-04-07 16:45:13.411339,2021-04-08 16:45:13.411339,,,
54,https://twitter.com/LEAD_Coalition,lead_coalition,Organizations,Aging Organizations,,N,Twitter,https://twitter.com/LEAD_Coalition/status/1380254872889663499,https://pbs.twimg.com/media/Eyd6qjaXIAQvPOv?format=jpg&name=small,2021-04-08 20:23:00+00:00,"#Driving and #Dementia: When it’s time to turn over the keys https://t.co/YcUrFtZGBu via @Penn_Memory

#Alzheimers @wordrefiner @MensHlthNetwork @ForexStopHunter @ZenAndHopscotch @HelenResists @underthesea62 @RetirementMedia @ChronicPainDad @ltwlauren @NJdoc @joebuchel @Oscarbob https://t.co/RAwXdPhhNL","#Driving and #Dementia: When it’s time to turn over the keys pennmemorycenter.org/driving-and-de… via @Penn_Memory

#Alzheimers @wordrefiner @MensHlthNetwork @ForexStopHunter @ZenAndHopscotch @HelenResists @underthesea62 @RetirementMedia @ChronicPainDad @ltwlauren @NJdoc @joebuchel @Oscarbob https://t.co/RAwXdPhhNL",1380254872889663499,"{'username': 'LEAD_Coalition', 'displayname': 'Ian Kremer', 'id': 64703161, 'description': 'Exec. Dir. of the LEAD Coalition (a diverse national coalition of organizations advancing #dementia quality of life, care, support & research). @WUSTL @UMichLaw', 'rawDescription': 'Exec. Dir. of the LEAD Coalition (a diverse national coalition of organizations advancing #dementia quality of life, care, support & research). @WUSTL @UMichLaw', 'descriptionUrls': [], 'verified': False, 'created': datetime.datetime(2009, 8, 11, 12, 46, 38, tzinfo=datetime.timezone.utc), 'followersCount': 43347, 'friendsCount': 33457, 'statusesCount': 41957, 'favouritesCount': 43285, 'listedCount': 915, 'mediaCount': 24095, 'location': 'Washington, DC', 'protected': False, 'linkUrl': 'http://www.leadcoalition.org', 'linkTcourl': 'http://t.co/7f8EYnVE4q', 'profileImageUrl': 'https://pbs.twimg.com/profile_images/378800000543724265/5d4f0faa1af2a5d0ea796c0041484706_normal.jpeg', 'profileBannerUrl': 'https://pbs.twimg.com/profile_banners/64703161/1402079171'}",['https://pennmemorycenter.org/driving-and-dementia/'],['https://t.co/YcUrFtZGBu'],0,6,8,2,1380254872889663499,en,"<a href=""https://about.twitter.com/products/tweetdeck"" rel=""nofollow"">TweetDeck</a>",https://about.twitter.com/products/tweetdeck,TweetDeck,"[{'previewUrl': 'https://pbs.twimg.com/media/Eyd6qjaXIAQvPOv?format=jpg&name=small', 'fullUrl': 'https://pbs.twimg.com/media/Eyd6qjaXIAQvPOv?format=jpg&name=large', 'type': 'photo'}]",,,"[{'username': 'Penn_Memory', 'displayname': 'Penn Memory Center', 'id': 3729534557, 'description': None, 'rawDescription': None, 'descriptionUrls': None, 'verified': None, 'created': None, 'followersCount': None, 'friendsCount': None, 'statusesCount': None, 'favouritesCount': None, 'listedCount': None, 'mediaCount': None, 'location': None, 'protected': None, 'linkUrl': None, 'linkTcourl': None, 'profileImageUrl': None, 'profileBannerUrl': None}, {'username': 'wordrefiner', 'displayname': 'Mark Schultz', 'id': 3081786572, 'description': None, 'rawDescription': None, 'descriptionUrls': None, 'verified': None, 'created': None, 'followersCount': None, 'friendsCount': None, 'statusesCount': None, 'favouritesCount': None, 'listedCount': None, 'mediaCount': None, 'location': None, 'protected': None, 'linkUrl': None, 'linkTcourl': None, 'profileImageUrl': None, 'profileBannerUrl': None}, {'username': 'MensHlthNetwork', 'displayname': ""Men's Health Network"", 'id': 38449898, 'description': None, 'rawDescription': None, 'descriptionUrls': None, 'verified': None, 'created': None, 'followersCount': None, 'friendsCount': None, 'statusesCount': None, 'favouritesCount': None, 'listedCount': None, 'mediaCount': None, 'location': None, 'protected': None, 'linkUrl': None, 'linkTcourl': None, 'profileImageUrl': None, 'profileBannerUrl': None}, {'username': 'ForexStopHunter', 'displayname': 'Dale Pinkert', 'id': 229143589, 'description': None, 'rawDescription': None, 'descriptionUrls': None, 'verified': None, 'created': None, 'followersCount': None, 'friendsCount': None, 'statusesCount': None, 'favouritesCount': None, 'listedCount': None, 'mediaCount': None, 'location': None, 'protected': None, 'linkUrl': None, 'linkTcourl': None, 'profileImageUrl': None, 'profileBannerUrl': None}, {'username': 'ZenAndHopscotch', 'displayname': '🧘🏽 Zen TF Out 🧘🏽', 'id': 3297413262, 'description': None, 'rawDescription': None, 'descriptionUrls': None, 'verified': None, 'created': None, 'followersCount': None, 'friendsCount': None, 'statusesCount': None, 'favouritesCount': None, 'listedCount': None, 'mediaCount': None, 'location': None, 'protected': None, 'linkUrl': None, 'linkTcourl': None, 'profileImageUrl': None, 'profileBannerUrl': None}, {'username': 'HelenResists', 'displayname': 'Helen Resists 💗RBG💗', 'id': 2310662821, 'description': None, 'rawDescription': None, 'descriptionUrls': None, 'verified': None, 'created': None, 'followersCount': None, 'friendsCount': None, 'statusesCount': None, 'favouritesCount': None, 'listedCount': None, 'mediaCount': None, 'location': None, 'protected': None, 'linkUrl': None, 'linkTcourl': None, 'profileImageUrl': None, 'profileBannerUrl': None}, {'username': 'underthesea62', 'displayname': 'Elizabeth F.💛', 'id': 1177749066920292354, 'description': None, 'rawDescription': None, 'descriptionUrls': None, 'verified': None, 'created': None, 'followersCount': None, 'friendsCount': None, 'statusesCount': None, 'favouritesCount': None, 'listedCount': None, 'mediaCount': None, 'location': None, 'protected': None, 'linkUrl': None, 'linkTcourl': None, 'profileImageUrl': None, 'profileBannerUrl': None}, {'username': 'RetirementMedia', 'displayname': 'Retirement Media', 'id': 53288855, 'description': None, 'rawDescription': None, 'descriptionUrls': None, 'verified': None, 'created': None, 'followersCount': None, 'friendsCount': None, 'statusesCount': None, 'favouritesCount': None, 'listedCount': None, 'mediaCount': None, 'location': None, 'protected': None, 'linkUrl': None, 'linkTcourl': None, 'profileImageUrl': None, 'profileBannerUrl': None}, {'username': 'ChronicPainDad', 'displayname': 'Chris✞chronicpainDAD', 'id': 1110475417, 'description': None, 'rawDescription': None, 'descriptionUrls': None, 'verified': None, 'created': None, 'followersCount': None, 'friendsCount': None, 'statusesCount': None, 'favouritesCount': None, 'listedCount': None, 'mediaCount': None, 'location': None, 'protected': None, 'linkUrl': None, 'linkTcourl': None, 'profileImageUrl': None, 'profileBannerUrl': None}, {'username': 'ltwlauren', 'displayname': 'Laurenltw', 'id': 753233805041815553, 'description': None, 'rawDescription': None, 'descriptionUrls': None, 'verified': None, 'created': None, 'followersCount': None, 'friendsCount': None, 'statusesCount': None, 'favouritesCount': None, 'listedCount': None, 'mediaCount': None, 'location': None, 'protected': None, 'linkUrl': None, 'linkTcourl': None, 'profileImageUrl': None, 'profileBannerUrl': None}, {'username': 'NJdoc', 'displayname': 'Mark', 'id': 21460496, 'description': None, 'rawDescription': None, 'descriptionUrls': None, 'verified': None, 'created': None, 'followersCount': None, 'friendsCount': None, 'statusesCount': None, 'favouritesCount': None, 'listedCount': None, 'mediaCount': None, 'location': None, 'protected': None, 'linkUrl': None, 'linkTcourl': None, 'profileImageUrl': None, 'profileBannerUrl': None}, {'username': 'joebuchel', 'displayname': 'Joe Buchel', 'id': 297073869, 'description': None, 'rawDescription': None, 'descriptionUrls': None, 'verified': None, 'created': None, 'followersCount': None, 'friendsCount': None, 'statusesCount': None, 'favouritesCount': None, 'listedCount': None, 'mediaCount': None, 'location': None, 'protected': None, 'linkUrl': None, 'linkTcourl': None, 'profileImageUrl': None, 'profileBannerUrl': None}, {'username': 'Oscarbob', 'displayname': 'Bob Meyer', 'id': 39643733, 'description': None, 'rawDescription': None, 'descriptionUrls': None, 'verified': None, 'created': None, 'followersCount': None, 'friendsCount': None, 'statusesCount': None, 'favouritesCount': None, 'listedCount': None, 'mediaCount': None, 'location': None, 'protected': None, 'linkUrl': None, 'linkTcourl': None, 'profileImageUrl': None, 'profileBannerUrl': None}]",2021-04-07 16:45:13.411339,2021-04-08 16:45:13.411339,,,
84,https://twitter.com/uspirg,uspirg,Organizations,Consumer Advocates,,N,Twitter,https://twitter.com/uspirg/status/1380253285383213059,,2021-04-08 20:16:41+00:00,"Want to learn more about ongoing plastic legislation in your state?

Join us on Friday, April 16th at 1:00pm ET / 10:00am PT for a virtual rally to find out. #USAgainstPlastic

Register here: https://t.co/XpCBOcrS8c","Want to learn more about ongoing plastic legislation in your state?

Join us on Friday, April 16th at 1:00pm ET / 10:00am PT for a virtual rally to find out. #USAgainstPlastic

Register here: uspirg.webaction.org/p/salsa/event/…",1380253285383213059,"{'username': 'uspirg', 'displayname': 'U.S. PIRG', 'id': 42660729, 'description': 'U.S. PIRG, the United States Public Interest Research Group, is a state-based, citizen-funded advocacy group that promotes the public interest.', 'rawDescription': 'U.S. PIRG, the United States Public Interest Research Group, is a state-based, citizen-funded advocacy group that promotes the public interest.', 'descriptionUrls': [], 'verified': True, 'created': datetime.datetime(2009, 5, 26, 16, 34, 32, tzinfo=datetime.timezone.utc), 'followersCount': 9760, 'friendsCount': 3481, 'statusesCount': 14435, 'favouritesCount': 1327, 'listedCount': 524, 'mediaCount': 3837, 'location': 'United States', 'protected': False, 'linkUrl': 'http://www.uspirg.org', 'linkTcourl': 'https://t.co/iGmfe4F3pU', 'profileImageUrl': 'https://pbs.twimg.com/profile_images/1255161973588684802/4i5e4Mpv_normal.png', 'profileBannerUrl': 'https://pbs.twimg.com/profile_banners/42660729/1430156203'}",['https://uspirg.webaction.org/p/salsa/event/common/public/?event_KEY=1106'],['https://t.co/XpCBOcrS8c'],0,1,0,0,1380253285383213059,en,"<a href=""https://about.twitter.com/products/tweetdeck"" rel=""nofollow"">TweetDeck</a>",https://about.twitter.com/products/tweetdeck,TweetDeck,,,,,2021-04-07 16:45:13.411339,2021-04-08 16:45:13.411339,,,
