,handle,state,platform,type,ref,flag,post_id,text,post_text,shared_text,time,image,video,video_thumbnail,video_id,likes,comments,shares,post_url,link,user_id,username,is_live,images
0,leadingage,National,Facebook,LA,#HQ,,10159477284730680,"President Biden’s infrastructure plan must prioritize internet access in affordable housing to ensure that the more than 2.2 million older adults who live in federally subsidized buildings have basic internet access.

MCKNIGHTSSENIORLIVING.COM
Biden’s infrastructure plan includes prioritized funding for affordable housing, long-term care - Business Daily News - McKnight's Senior Living",President Biden’s infrastructure plan must prioritize internet access in affordable housing to ensure that the more than 2.2 million older adults who live in federally subsidized buildings have basic internet access.,"MCKNIGHTSSENIORLIVING.COM
Biden’s infrastructure plan includes prioritized funding for affordable housing, long-term care - Business Daily News - McKnight's Senior Living",2021-04-01 17:34:02,,,,,7,0,0,https://facebook.com/leadingage/posts/10159477284730680,https://www.mcknightsseniorliving.com/home/news/business-daily-news/bidens-infrastructure-plan-includes-prioritized-funding-for-affordable-housing-long-term-care/,51359055679,LeadingAge,False,[]
1,leadingage,National,Facebook,LA,#HQ,,10159476940190680,"NEW! The LeadingAge Student Membership provides career development opportunities, peer connections, and member resources that will kickstart your career. Join a community of aging services professionals with ONE easy application: http://bit.ly/LeadingAgeStudent","NEW! The LeadingAge Student Membership provides career development opportunities, peer connections, and member resources that will kickstart your career. Join a community of aging services professionals with ONE easy application: http://bit.ly/LeadingAgeStudent",,2021-04-01 14:41:50,https://scontent-lga3-1.xx.fbcdn.net/v/t1.6435-9/fr/cp0/e15/q65/167983528_10159476940200680_4262832883486040831_n.jpg?_nc_cat=101&ccb=1-3&_nc_sid=da1649&_nc_ohc=Nm1fd-8EhB8AX_fMIo9&_nc_ht=scontent-lga3-1.xx&tp=14&oh=ed6d153379e650bc4edb207de541ac37&oe=608BCCB4,,,,0,0,0,https://facebook.com/leadingage/posts/10159476940190680,https://bit.ly/LeadingAgeStudent,51359055679,LeadingAge,False,"['https://scontent-lga3-1.xx.fbcdn.net/v/t1.6435-9/fr/cp0/e15/q65/167983528_10159476940200680_4262832883486040831_n.jpg?_nc_cat=101&ccb=1-3&_nc_sid=da1649&_nc_ohc=Nm1fd-8EhB8AX_fMIo9&_nc_ht=scontent-lga3-1.xx&tp=14&oh=ed6d153379e650bc4edb207de541ac37&oe=608BCCB4', 'https://scontent-lga3-1.xx.fbcdn.net/v/t1.6435-9/fr/cp0/e15/q65/167983528_10159476940200680_4262832883486040831_n.jpg?_nc_cat=101&ccb=1-3&_nc_sid=da1649&_nc_ohc=Nm1fd-8EhB8AX_fMIo9&_nc_ht=scontent-lga3-1.xx&tp=14&oh=ed6d153379e650bc4edb207de541ac37&oe=608BCCB4', 'https://scontent-lga3-1.xx.fbcdn.net/v/t1.6435-9/fr/cp0/e15/q65/167983528_10159476940200680_4262832883486040831_n.jpg?_nc_cat=101&ccb=1-3&_nc_sid=da1649&_nc_ohc=Nm1fd-8EhB8AX_fMIo9&_nc_ht=scontent-lga3-1.xx&tp=14&oh=ed6d153379e650bc4edb207de541ac37&oe=608BCCB4']"
